{
  "title": "Tuckman's Model of Team Development",
  "stages": "[{\"name\":\"Forming\",\"desc\":\"The team orients to the work and looks to the leader for structure. Goals, roles, and working agreements need to be made explicit before momentum builds.\"},{\"name\":\"Storming\",\"desc\":\"Different expectations and working styles surface. Productive conflict is normal here; the job is to make tension discussable and turn it into decisions.\"},{\"name\":\"Norming\",\"desc\":\"Trust, routines, and shared standards begin to settle. The team learns how to collaborate and correct small issues before they grow.\"},{\"name\":\"Performing\",\"desc\":\"The team operates with confidence and autonomy. The leader delegates, removes blockers, and keeps attention on outcomes.\"}]",
  "xAxisLabel": "Time",
  "yAxisLabel": "Effectiveness",
  "curveColor": "#285f9f",
  "dotColor": "#0aa0d8",
  "bgColor": "#f5f2ea",
  "basePlateImage": "v2-base-blue.png",
  "durationPerStage": 5.5
}
